after the final planting date or that cannot be planted.,after the final planting date or that cannot be planted.,any public assistance program. (Not all prohibited bases apply,any public assistance program. (Not all prohibited bases apply,any public assistance program. (Not all prohibited bases apply,any public assistance program. (Not all prohibited bases apply,any public assistance program. (Not all prohibited bases apply
Please consult a crop insurance agent for details.,Please consult a crop insurance agent for details.,to all programs.) Persons with disabilities who require alterna-,to all programs.) Persons with disabilities who require alterna-,to all programs.) Persons with disabilities who require alterna-,to all programs.) Persons with disabilities who require alterna-,to all programs.) Persons with disabilities who require alterna-
,,"tive means for communication of program information (Braille,","tive means for communication of program information (Braille,","tive means for communication of program information (Braille,","tive means for communication of program information (Braille,","tive means for communication of program information (Braille,"
Loss Example,Loss Example,"large print, audiotape, etc.) should contact USDA’s TARGET","large print, audiotape, etc.) should contact USDA’s TARGET","large print, audiotape, etc.) should contact USDA’s TARGET","large print, audiotape, etc.) should contact USDA’s TARGET","large print, audiotape, etc.) should contact USDA’s TARGET"
,,Center at 202-720-2600 (voice and TDD).,Center at 202-720-2600 (voice and TDD).,Center at 202-720-2600 (voice and TDD).,,
Assume grain sorghum with an approved yield of 60,Assume grain sorghum with an approved yield of 60,,,,,
"bushels per acre, 75-percent coverage level, $5.29","bushels per acre, 75-percent coverage level, $5.29","To file a complaint of discrimination, complete, sign and mail a","To file a complaint of discrimination, complete, sign and mail a","To file a complaint of discrimination, complete, sign and mail a","To file a complaint of discrimination, complete, sign and mail a","To file a complaint of discrimination, complete, sign and mail a"
"projected price, $4.49 harvest price, and 15 bushels","projected price, $4.49 harvest price, and 15 bushels","program discrimination complaint form, (available at any USDA","program discrimination complaint form, (available at any USDA","program discrimination complaint form, (available at any USDA","program discrimination complaint form, (available at any USDA","program discrimination complaint form, (available at any USDA"
"produced. For Revenue Protection, the insurance guarantee","produced. For Revenue Protection, the insurance guarantee","office location or online at www.ascr.usda.gov), to: United","office location or online at www.ascr.usda.gov), to: United","office location or online at www.ascr.usda.gov), to: United","office location or online at www.ascr.usda.gov), to: United",
,,States Department of Agriculture; Office of the Assistant Secre-,States Department of Agriculture; Office of the Assistant Secre-,States Department of Agriculture; Office of the Assistant Secre-,States Department of Agriculture; Office of the Assistant Secre-,States Department of Agriculture; Office of the Assistant Secre-
is equal to the production guarantee multiplied by the,is equal to the production guarantee multiplied by the,"tary for Civil Rights; 1400 Independence Ave., SW; Washington,","tary for Civil Rights; 1400 Independence Ave., SW; Washington,","tary for Civil Rights; 1400 Independence Ave., SW; Washington,","tary for Civil Rights; 1400 Independence Ave., SW; Washington,","tary for Civil Rights; 1400 Independence Ave., SW; Washington,"
greater of the projected price or the harvest price. In this,greater of the projected price or the harvest price. In this,DC 20250-9410. Or call toll free at (866) 632-9992 (voice) to,DC 20250-9410. Or call toll free at (866) 632-9992 (voice) to,DC 20250-9410. Or call toll free at (866) 632-9992 (voice) to,DC 20250-9410. Or call toll free at (866) 632-9992 (voice) to,DC 20250-9410. Or call toll free at (866) 632-9992 (voice) to
"example, the Revenue Protection harvest guarantee","example, the Revenue Protection harvest guarantee","obtain additional information, the appropriate office or to request","obtain additional information, the appropriate office or to request","obtain additional information, the appropriate office or to request","obtain additional information, the appropriate office or to request","obtain additional information, the appropriate office or to request"
,,"documents. Individuals who are deaf, hard of hearing, or have","documents. Individuals who are deaf, hard of hearing, or have","documents. Individuals who are deaf, hard of hearing, or have","documents. Individuals who are deaf, hard of hearing, or have","documents. Individuals who are deaf, hard of hearing, or have"
,,speech disabilities may contact USDA through the Federal Re-,speech disabilities may contact USDA through the Federal Re-,speech disabilities may contact USDA through the Federal Re-,speech disabilities may contact USDA through the Federal Re-,speech disabilities may contact USDA through the Federal Re-
,,lay service at (800) 877-8339 or (800) 845-6136.,lay service at (800) 877-8339 or (800) 845-6136.,lay service at (800) 877-8339 or (800) 845-6136.,,
