Figure 2.3-5 illustrates the Candidate Build Alternatives. Refinements to the alignment of each CBA have,Figure 2.3-5 illustrates the Candidate Build Alternatives. Refinements to the alignment of each CBA have,Figure 2.3-5 illustrates the Candidate Build Alternatives. Refinements to the alignment of each CBA have,Figure 2.3-5 illustrates the Candidate Build Alternatives. Refinements to the alignment of each CBA have,Figure 2.3-5 illustrates the Candidate Build Alternatives. Refinements to the alignment of each CBA have,Figure 2.3-5 illustrates the Candidate Build Alternatives. Refinements to the alignment of each CBA have,Figure 2.3-5 illustrates the Candidate Build Alternatives. Refinements to the alignment of each CBA have,Figure 2.3-5 illustrates the Candidate Build Alternatives. Refinements to the alignment of each CBA have,Figure 2.3-5 illustrates the Candidate Build Alternatives. Refinements to the alignment of each CBA have,Figure 2.3-5 illustrates the Candidate Build Alternatives. Refinements to the alignment of each CBA have,Figure 2.3-5 illustrates the Candidate Build Alternatives. Refinements to the alignment of each CBA have,Figure 2.3-5 illustrates the Candidate Build Alternatives. Refinements to the alignment of each CBA have,Figure 2.3-5 illustrates the Candidate Build Alternatives. Refinements to the alignment of each CBA have,Figure 2.3-5 illustrates the Candidate Build Alternatives. Refinements to the alignment of each CBA have,Figure 2.3-5 illustrates the Candidate Build Alternatives. Refinements to the alignment of each CBA have,Figure 2.3-5 illustrates the Candidate Build Alternatives. Refinements to the alignment of each CBA have,Figure 2.3-5 illustrates the Candidate Build Alternatives. Refinements to the alignment of each CBA have,Figure 2.3-5 illustrates the Candidate Build Alternatives. Refinements to the alignment of each CBA have,Figure 2.3-5 illustrates the Candidate Build Alternatives. Refinements to the alignment of each CBA have,Figure 2.3-5 illustrates the Candidate Build Alternatives. Refinements to the alignment of each CBA have,Figure 2.3-5 illustrates the Candidate Build Alternatives. Refinements to the alignment of each CBA have
occurred to further reduce their impacts to the natural and built environment. These refinements have,occurred to further reduce their impacts to the natural and built environment. These refinements have,occurred to further reduce their impacts to the natural and built environment. These refinements have,occurred to further reduce their impacts to the natural and built environment. These refinements have,occurred to further reduce their impacts to the natural and built environment. These refinements have,occurred to further reduce their impacts to the natural and built environment. These refinements have,occurred to further reduce their impacts to the natural and built environment. These refinements have,occurred to further reduce their impacts to the natural and built environment. These refinements have,occurred to further reduce their impacts to the natural and built environment. These refinements have,occurred to further reduce their impacts to the natural and built environment. These refinements have,occurred to further reduce their impacts to the natural and built environment. These refinements have,occurred to further reduce their impacts to the natural and built environment. These refinements have,occurred to further reduce their impacts to the natural and built environment. These refinements have,occurred to further reduce their impacts to the natural and built environment. These refinements have,occurred to further reduce their impacts to the natural and built environment. These refinements have,occurred to further reduce their impacts to the natural and built environment. These refinements have,occurred to further reduce their impacts to the natural and built environment. These refinements have,occurred to further reduce their impacts to the natural and built environment. These refinements have,occurred to further reduce their impacts to the natural and built environment. These refinements have,occurred to further reduce their impacts to the natural and built environment. These refinements have,occurred to further reduce their impacts to the natural and built environment. These refinements have
"included shifts to avoid wetlands, properties eligible for listing on the National Register of Historic Places","included shifts to avoid wetlands, properties eligible for listing on the National Register of Historic Places","included shifts to avoid wetlands, properties eligible for listing on the National Register of Historic Places","included shifts to avoid wetlands, properties eligible for listing on the National Register of Historic Places","included shifts to avoid wetlands, properties eligible for listing on the National Register of Historic Places","included shifts to avoid wetlands, properties eligible for listing on the National Register of Historic Places","included shifts to avoid wetlands, properties eligible for listing on the National Register of Historic Places","included shifts to avoid wetlands, properties eligible for listing on the National Register of Historic Places","included shifts to avoid wetlands, properties eligible for listing on the National Register of Historic Places","included shifts to avoid wetlands, properties eligible for listing on the National Register of Historic Places","included shifts to avoid wetlands, properties eligible for listing on the National Register of Historic Places","included shifts to avoid wetlands, properties eligible for listing on the National Register of Historic Places","included shifts to avoid wetlands, properties eligible for listing on the National Register of Historic Places","included shifts to avoid wetlands, properties eligible for listing on the National Register of Historic Places","included shifts to avoid wetlands, properties eligible for listing on the National Register of Historic Places","included shifts to avoid wetlands, properties eligible for listing on the National Register of Historic Places","included shifts to avoid wetlands, properties eligible for listing on the National Register of Historic Places","included shifts to avoid wetlands, properties eligible for listing on the National Register of Historic Places","included shifts to avoid wetlands, properties eligible for listing on the National Register of Historic Places","included shifts to avoid wetlands, properties eligible for listing on the National Register of Historic Places","included shifts to avoid wetlands, properties eligible for listing on the National Register of Historic Places"
"(NRHP), and planned development projects. These revised locations of each CBA alignment were used","(NRHP), and planned development projects. These revised locations of each CBA alignment were used","(NRHP), and planned development projects. These revised locations of each CBA alignment were used","(NRHP), and planned development projects. These revised locations of each CBA alignment were used","(NRHP), and planned development projects. These revised locations of each CBA alignment were used","(NRHP), and planned development projects. These revised locations of each CBA alignment were used","(NRHP), and planned development projects. These revised locations of each CBA alignment were used","(NRHP), and planned development projects. These revised locations of each CBA alignment were used","(NRHP), and planned development projects. These revised locations of each CBA alignment were used","(NRHP), and planned development projects. These revised locations of each CBA alignment were used","(NRHP), and planned development projects. These revised locations of each CBA alignment were used","(NRHP), and planned development projects. These revised locations of each CBA alignment were used","(NRHP), and planned development projects. These revised locations of each CBA alignment were used","(NRHP), and planned development projects. These revised locations of each CBA alignment were used","(NRHP), and planned development projects. These revised locations of each CBA alignment were used","(NRHP), and planned development projects. These revised locations of each CBA alignment were used","(NRHP), and planned development projects. These revised locations of each CBA alignment were used","(NRHP), and planned development projects. These revised locations of each CBA alignment were used","(NRHP), and planned development projects. These revised locations of each CBA alignment were used","(NRHP), and planned development projects. These revised locations of each CBA alignment were used","(NRHP), and planned development projects. These revised locations of each CBA alignment were used"
"for impact analysis, and are depicted in the figures located in Chapter 4.","for impact analysis, and are depicted in the figures located in Chapter 4.","for impact analysis, and are depicted in the figures located in Chapter 4.","for impact analysis, and are depicted in the figures located in Chapter 4.","for impact analysis, and are depicted in the figures located in Chapter 4.","for impact analysis, and are depicted in the figures located in Chapter 4.","for impact analysis, and are depicted in the figures located in Chapter 4.","for impact analysis, and are depicted in the figures located in Chapter 4.","for impact analysis, and are depicted in the figures located in Chapter 4.","for impact analysis, and are depicted in the figures located in Chapter 4.","for impact analysis, and are depicted in the figures located in Chapter 4.","for impact analysis, and are depicted in the figures located in Chapter 4.","for impact analysis, and are depicted in the figures located in Chapter 4.","for impact analysis, and are depicted in the figures located in Chapter 4.","For CBA 2, the centerline of","For CBA 2, the centerline of","For CBA 2, the centerline of","For CBA 2, the centerline of","For CBA 2, the centerline of","For CBA 2, the centerline of","For CBA 2, the centerline of"
proposed widening along the existing alignment was shifted to minimize potential displacements along,proposed widening along the existing alignment was shifted to minimize potential displacements along,proposed widening along the existing alignment was shifted to minimize potential displacements along,proposed widening along the existing alignment was shifted to minimize potential displacements along,proposed widening along the existing alignment was shifted to minimize potential displacements along,proposed widening along the existing alignment was shifted to minimize potential displacements along,proposed widening along the existing alignment was shifted to minimize potential displacements along,proposed widening along the existing alignment was shifted to minimize potential displacements along,proposed widening along the existing alignment was shifted to minimize potential displacements along,proposed widening along the existing alignment was shifted to minimize potential displacements along,proposed widening along the existing alignment was shifted to minimize potential displacements along,proposed widening along the existing alignment was shifted to minimize potential displacements along,proposed widening along the existing alignment was shifted to minimize potential displacements along,proposed widening along the existing alignment was shifted to minimize potential displacements along,proposed widening along the existing alignment was shifted to minimize potential displacements along,proposed widening along the existing alignment was shifted to minimize potential displacements along,proposed widening along the existing alignment was shifted to minimize potential displacements along,proposed widening along the existing alignment was shifted to minimize potential displacements along,proposed widening along the existing alignment was shifted to minimize potential displacements along,proposed widening along the existing alignment was shifted to minimize potential displacements along,proposed widening along the existing alignment was shifted to minimize potential displacements along
"the ROW. If CBA 2 is selected, more detailed consideration of improvements along the existing ROW","the ROW. If CBA 2 is selected, more detailed consideration of improvements along the existing ROW","the ROW. If CBA 2 is selected, more detailed consideration of improvements along the existing ROW","the ROW. If CBA 2 is selected, more detailed consideration of improvements along the existing ROW","the ROW. If CBA 2 is selected, more detailed consideration of improvements along the existing ROW","the ROW. If CBA 2 is selected, more detailed consideration of improvements along the existing ROW","the ROW. If CBA 2 is selected, more detailed consideration of improvements along the existing ROW","the ROW. If CBA 2 is selected, more detailed consideration of improvements along the existing ROW","the ROW. If CBA 2 is selected, more detailed consideration of improvements along the existing ROW","the ROW. If CBA 2 is selected, more detailed consideration of improvements along the existing ROW","the ROW. If CBA 2 is selected, more detailed consideration of improvements along the existing ROW","the ROW. If CBA 2 is selected, more detailed consideration of improvements along the existing ROW","the ROW. If CBA 2 is selected, more detailed consideration of improvements along the existing ROW","the ROW. If CBA 2 is selected, more detailed consideration of improvements along the existing ROW","the ROW. If CBA 2 is selected, more detailed consideration of improvements along the existing ROW","the ROW. If CBA 2 is selected, more detailed consideration of improvements along the existing ROW","the ROW. If CBA 2 is selected, more detailed consideration of improvements along the existing ROW","the ROW. If CBA 2 is selected, more detailed consideration of improvements along the existing ROW","the ROW. If CBA 2 is selected, more detailed consideration of improvements along the existing ROW","the ROW. If CBA 2 is selected, more detailed consideration of improvements along the existing ROW","the ROW. If CBA 2 is selected, more detailed consideration of improvements along the existing ROW"
would occur during final design. Improvements would be coordinated with local governments and would,would occur during final design. Improvements would be coordinated with local governments and would,would occur during final design. Improvements would be coordinated with local governments and would,would occur during final design. Improvements would be coordinated with local governments and would,would occur during final design. Improvements would be coordinated with local governments and would,would occur during final design. Improvements would be coordinated with local governments and would,would occur during final design. Improvements would be coordinated with local governments and would,would occur during final design. Improvements would be coordinated with local governments and would,would occur during final design. Improvements would be coordinated with local governments and would,would occur during final design. Improvements would be coordinated with local governments and would,would occur during final design. Improvements would be coordinated with local governments and would,would occur during final design. Improvements would be coordinated with local governments and would,would occur during final design. Improvements would be coordinated with local governments and would,would occur during final design. Improvements would be coordinated with local governments and would,would occur during final design. Improvements would be coordinated with local governments and would,would occur during final design. Improvements would be coordinated with local governments and would,would occur during final design. Improvements would be coordinated with local governments and would,would occur during final design. Improvements would be coordinated with local governments and would,would occur during final design. Improvements would be coordinated with local governments and would,would occur during final design. Improvements would be coordinated with local governments and would,would occur during final design. Improvements would be coordinated with local governments and would
likely include access management to control the number of driveways and curb cuts along the route.,likely include access management to control the number of driveways and curb cuts along the route.,likely include access management to control the number of driveways and curb cuts along the route.,likely include access management to control the number of driveways and curb cuts along the route.,likely include access management to control the number of driveways and curb cuts along the route.,likely include access management to control the number of driveways and curb cuts along the route.,likely include access management to control the number of driveways and curb cuts along the route.,likely include access management to control the number of driveways and curb cuts along the route.,likely include access management to control the number of driveways and curb cuts along the route.,likely include access management to control the number of driveways and curb cuts along the route.,likely include access management to control the number of driveways and curb cuts along the route.,likely include access management to control the number of driveways and curb cuts along the route.,likely include access management to control the number of driveways and curb cuts along the route.,likely include access management to control the number of driveways and curb cuts along the route.,likely include access management to control the number of driveways and curb cuts along the route.,likely include access management to control the number of driveways and curb cuts along the route.,likely include access management to control the number of driveways and curb cuts along the route.,likely include access management to control the number of driveways and curb cuts along the route.,likely include access management to control the number of driveways and curb cuts along the route.,,
Route 460 Location Study,Route 460 Location Study,Route 460 Location Study,Route 460 Location Study,,,,,,2-13,,,,,Draft Environmental Impact Statement,Draft Environmental Impact Statement,Draft Environmental Impact Statement,Draft Environmental Impact Statement,Draft Environmental Impact Statement,Draft Environmental Impact Statement,Draft Environmental Impact Statement
,,,,,,,,,,,,,,,,,,May,2005,2005
