acres of Section 4(f) properties of all ten alternatives. Alternative C is close to the existing communities,acres of Section 4(f) properties of all ten alternatives. Alternative C is close to the existing communities,acres of Section 4(f) properties of all ten alternatives. Alternative C is close to the existing communities,acres of Section 4(f) properties of all ten alternatives. Alternative C is close to the existing communities,acres of Section 4(f) properties of all ten alternatives. Alternative C is close to the existing communities,acres of Section 4(f) properties of all ten alternatives. Alternative C is close to the existing communities,acres of Section 4(f) properties of all ten alternatives. Alternative C is close to the existing communities,acres of Section 4(f) properties of all ten alternatives. Alternative C is close to the existing communities,acres of Section 4(f) properties of all ten alternatives. Alternative C is close to the existing communities,acres of Section 4(f) properties of all ten alternatives. Alternative C is close to the existing communities,acres of Section 4(f) properties of all ten alternatives. Alternative C is close to the existing communities,acres of Section 4(f) properties of all ten alternatives. Alternative C is close to the existing communities,acres of Section 4(f) properties of all ten alternatives. Alternative C is close to the existing communities,acres of Section 4(f) properties of all ten alternatives. Alternative C is close to the existing communities,acres of Section 4(f) properties of all ten alternatives. Alternative C is close to the existing communities,acres of Section 4(f) properties of all ten alternatives. Alternative C is close to the existing communities,acres of Section 4(f) properties of all ten alternatives. Alternative C is close to the existing communities,acres of Section 4(f) properties of all ten alternatives. Alternative C is close to the existing communities,acres of Section 4(f) properties of all ten alternatives. Alternative C is close to the existing communities,acres of Section 4(f) properties of all ten alternatives. Alternative C is close to the existing communities,acres of Section 4(f) properties of all ten alternatives. Alternative C is close to the existing communities
along Route 460; however it has a large number of potentially affected wetlands. Hybrid Alternative DC,along Route 460; however it has a large number of potentially affected wetlands. Hybrid Alternative DC,along Route 460; however it has a large number of potentially affected wetlands. Hybrid Alternative DC,along Route 460; however it has a large number of potentially affected wetlands. Hybrid Alternative DC,along Route 460; however it has a large number of potentially affected wetlands. Hybrid Alternative DC,along Route 460; however it has a large number of potentially affected wetlands. Hybrid Alternative DC,along Route 460; however it has a large number of potentially affected wetlands. Hybrid Alternative DC,along Route 460; however it has a large number of potentially affected wetlands. Hybrid Alternative DC,along Route 460; however it has a large number of potentially affected wetlands. Hybrid Alternative DC,along Route 460; however it has a large number of potentially affected wetlands. Hybrid Alternative DC,along Route 460; however it has a large number of potentially affected wetlands. Hybrid Alternative DC,along Route 460; however it has a large number of potentially affected wetlands. Hybrid Alternative DC,along Route 460; however it has a large number of potentially affected wetlands. Hybrid Alternative DC,along Route 460; however it has a large number of potentially affected wetlands. Hybrid Alternative DC,along Route 460; however it has a large number of potentially affected wetlands. Hybrid Alternative DC,along Route 460; however it has a large number of potentially affected wetlands. Hybrid Alternative DC,along Route 460; however it has a large number of potentially affected wetlands. Hybrid Alternative DC,along Route 460; however it has a large number of potentially affected wetlands. Hybrid Alternative DC,along Route 460; however it has a large number of potentially affected wetlands. Hybrid Alternative DC,along Route 460; however it has a large number of potentially affected wetlands. Hybrid Alternative DC,along Route 460; however it has a large number of potentially affected wetlands. Hybrid Alternative DC
"has a reduced number of Section 4(f) impacts, but also follows an alignment that takes it far away from","has a reduced number of Section 4(f) impacts, but also follows an alignment that takes it far away from","has a reduced number of Section 4(f) impacts, but also follows an alignment that takes it far away from","has a reduced number of Section 4(f) impacts, but also follows an alignment that takes it far away from","has a reduced number of Section 4(f) impacts, but also follows an alignment that takes it far away from","has a reduced number of Section 4(f) impacts, but also follows an alignment that takes it far away from","has a reduced number of Section 4(f) impacts, but also follows an alignment that takes it far away from","has a reduced number of Section 4(f) impacts, but also follows an alignment that takes it far away from","has a reduced number of Section 4(f) impacts, but also follows an alignment that takes it far away from","has a reduced number of Section 4(f) impacts, but also follows an alignment that takes it far away from","has a reduced number of Section 4(f) impacts, but also follows an alignment that takes it far away from","has a reduced number of Section 4(f) impacts, but also follows an alignment that takes it far away from","has a reduced number of Section 4(f) impacts, but also follows an alignment that takes it far away from","has a reduced number of Section 4(f) impacts, but also follows an alignment that takes it far away from","has a reduced number of Section 4(f) impacts, but also follows an alignment that takes it far away from","has a reduced number of Section 4(f) impacts, but also follows an alignment that takes it far away from","has a reduced number of Section 4(f) impacts, but also follows an alignment that takes it far away from","has a reduced number of Section 4(f) impacts, but also follows an alignment that takes it far away from","has a reduced number of Section 4(f) impacts, but also follows an alignment that takes it far away from","has a reduced number of Section 4(f) impacts, but also follows an alignment that takes it far away from","has a reduced number of Section 4(f) impacts, but also follows an alignment that takes it far away from"
Wakefield and Waverly.,Wakefield and Waverly.,Wakefield and Waverly.,Wakefield and Waverly.,Wakefield and Waverly.,"Alternative DC1 has similar characteristics of Alternative DC, but it provides","Alternative DC1 has similar characteristics of Alternative DC, but it provides","Alternative DC1 has similar characteristics of Alternative DC, but it provides","Alternative DC1 has similar characteristics of Alternative DC, but it provides","Alternative DC1 has similar characteristics of Alternative DC, but it provides","Alternative DC1 has similar characteristics of Alternative DC, but it provides","Alternative DC1 has similar characteristics of Alternative DC, but it provides","Alternative DC1 has similar characteristics of Alternative DC, but it provides","Alternative DC1 has similar characteristics of Alternative DC, but it provides","Alternative DC1 has similar characteristics of Alternative DC, but it provides","Alternative DC1 has similar characteristics of Alternative DC, but it provides","Alternative DC1 has similar characteristics of Alternative DC, but it provides","Alternative DC1 has similar characteristics of Alternative DC, but it provides","Alternative DC1 has similar characteristics of Alternative DC, but it provides","Alternative DC1 has similar characteristics of Alternative DC, but it provides","Alternative DC1 has similar characteristics of Alternative DC, but it provides"
better access to Waverly and Wakefield.,better access to Waverly and Wakefield.,better access to Waverly and Wakefield.,better access to Waverly and Wakefield.,better access to Waverly and Wakefield.,better access to Waverly and Wakefield.,better access to Waverly and Wakefield.,better access to Waverly and Wakefield.,,,,,,,,,,,,,
"On April 2, 2004, the conceptual alternatives and screening results were presented at a federal agency","On April 2, 2004, the conceptual alternatives and screening results were presented at a federal agency","On April 2, 2004, the conceptual alternatives and screening results were presented at a federal agency","On April 2, 2004, the conceptual alternatives and screening results were presented at a federal agency","On April 2, 2004, the conceptual alternatives and screening results were presented at a federal agency","On April 2, 2004, the conceptual alternatives and screening results were presented at a federal agency","On April 2, 2004, the conceptual alternatives and screening results were presented at a federal agency","On April 2, 2004, the conceptual alternatives and screening results were presented at a federal agency","On April 2, 2004, the conceptual alternatives and screening results were presented at a federal agency","On April 2, 2004, the conceptual alternatives and screening results were presented at a federal agency","On April 2, 2004, the conceptual alternatives and screening results were presented at a federal agency","On April 2, 2004, the conceptual alternatives and screening results were presented at a federal agency","On April 2, 2004, the conceptual alternatives and screening results were presented at a federal agency","On April 2, 2004, the conceptual alternatives and screening results were presented at a federal agency","On April 2, 2004, the conceptual alternatives and screening results were presented at a federal agency","On April 2, 2004, the conceptual alternatives and screening results were presented at a federal agency","On April 2, 2004, the conceptual alternatives and screening results were presented at a federal agency","On April 2, 2004, the conceptual alternatives and screening results were presented at a federal agency","On April 2, 2004, the conceptual alternatives and screening results were presented at a federal agency","On April 2, 2004, the conceptual alternatives and screening results were presented at a federal agency","On April 2, 2004, the conceptual alternatives and screening results were presented at a federal agency"
Partnering Meeting.,Partnering Meeting.,Partnering Meeting.,"Agencies participating at the meeting included the US Army Corps of Engineers, the","Agencies participating at the meeting included the US Army Corps of Engineers, the","Agencies participating at the meeting included the US Army Corps of Engineers, the","Agencies participating at the meeting included the US Army Corps of Engineers, the","Agencies participating at the meeting included the US Army Corps of Engineers, the","Agencies participating at the meeting included the US Army Corps of Engineers, the","Agencies participating at the meeting included the US Army Corps of Engineers, the","Agencies participating at the meeting included the US Army Corps of Engineers, the","Agencies participating at the meeting included the US Army Corps of Engineers, the","Agencies participating at the meeting included the US Army Corps of Engineers, the","Agencies participating at the meeting included the US Army Corps of Engineers, the","Agencies participating at the meeting included the US Army Corps of Engineers, the","Agencies participating at the meeting included the US Army Corps of Engineers, the","Agencies participating at the meeting included the US Army Corps of Engineers, the","Agencies participating at the meeting included the US Army Corps of Engineers, the","Agencies participating at the meeting included the US Army Corps of Engineers, the","Agencies participating at the meeting included the US Army Corps of Engineers, the","Agencies participating at the meeting included the US Army Corps of Engineers, the"
US,Fish,and,Wildlife,"Service,","Service,","Service,",the,Environmental,Environmental,Protection,Protection,Protection,"Agency,",and,and,the,Federal,Highway,Highway,Highway
Administration.,Administration.,Administration.,"Also, on April 14, 2004, the project Study Team, which includes staff from the Crater and","Also, on April 14, 2004, the project Study Team, which includes staff from the Crater and","Also, on April 14, 2004, the project Study Team, which includes staff from the Crater and","Also, on April 14, 2004, the project Study Team, which includes staff from the Crater and","Also, on April 14, 2004, the project Study Team, which includes staff from the Crater and","Also, on April 14, 2004, the project Study Team, which includes staff from the Crater and","Also, on April 14, 2004, the project Study Team, which includes staff from the Crater and","Also, on April 14, 2004, the project Study Team, which includes staff from the Crater and","Also, on April 14, 2004, the project Study Team, which includes staff from the Crater and","Also, on April 14, 2004, the project Study Team, which includes staff from the Crater and","Also, on April 14, 2004, the project Study Team, which includes staff from the Crater and","Also, on April 14, 2004, the project Study Team, which includes staff from the Crater and","Also, on April 14, 2004, the project Study Team, which includes staff from the Crater and","Also, on April 14, 2004, the project Study Team, which includes staff from the Crater and","Also, on April 14, 2004, the project Study Team, which includes staff from the Crater and","Also, on April 14, 2004, the project Study Team, which includes staff from the Crater and","Also, on April 14, 2004, the project Study Team, which includes staff from the Crater and","Also, on April 14, 2004, the project Study Team, which includes staff from the Crater and"
Hampton,Hampton,Roads,Planning,Planning,District,District,"Commissions,","Commissions,","Commissions,",met,to,further,consider,consider,the,alternative,alternative,screening.,screening.,screening.
"Consideration of the public comments, input from the federal agencies during partnering, and technical","Consideration of the public comments, input from the federal agencies during partnering, and technical","Consideration of the public comments, input from the federal agencies during partnering, and technical","Consideration of the public comments, input from the federal agencies during partnering, and technical","Consideration of the public comments, input from the federal agencies during partnering, and technical","Consideration of the public comments, input from the federal agencies during partnering, and technical","Consideration of the public comments, input from the federal agencies during partnering, and technical","Consideration of the public comments, input from the federal agencies during partnering, and technical","Consideration of the public comments, input from the federal agencies during partnering, and technical","Consideration of the public comments, input from the federal agencies during partnering, and technical","Consideration of the public comments, input from the federal agencies during partnering, and technical","Consideration of the public comments, input from the federal agencies during partnering, and technical","Consideration of the public comments, input from the federal agencies during partnering, and technical","Consideration of the public comments, input from the federal agencies during partnering, and technical","Consideration of the public comments, input from the federal agencies during partnering, and technical","Consideration of the public comments, input from the federal agencies during partnering, and technical","Consideration of the public comments, input from the federal agencies during partnering, and technical","Consideration of the public comments, input from the federal agencies during partnering, and technical","Consideration of the public comments, input from the federal agencies during partnering, and technical","Consideration of the public comments, input from the federal agencies during partnering, and technical","Consideration of the public comments, input from the federal agencies during partnering, and technical"
review by the Study Team led to the elimination of some conceptual alternatives and retention of others,review by the Study Team led to the elimination of some conceptual alternatives and retention of others,review by the Study Team led to the elimination of some conceptual alternatives and retention of others,review by the Study Team led to the elimination of some conceptual alternatives and retention of others,review by the Study Team led to the elimination of some conceptual alternatives and retention of others,review by the Study Team led to the elimination of some conceptual alternatives and retention of others,review by the Study Team led to the elimination of some conceptual alternatives and retention of others,review by the Study Team led to the elimination of some conceptual alternatives and retention of others,review by the Study Team led to the elimination of some conceptual alternatives and retention of others,review by the Study Team led to the elimination of some conceptual alternatives and retention of others,review by the Study Team led to the elimination of some conceptual alternatives and retention of others,review by the Study Team led to the elimination of some conceptual alternatives and retention of others,review by the Study Team led to the elimination of some conceptual alternatives and retention of others,review by the Study Team led to the elimination of some conceptual alternatives and retention of others,review by the Study Team led to the elimination of some conceptual alternatives and retention of others,review by the Study Team led to the elimination of some conceptual alternatives and retention of others,review by the Study Team led to the elimination of some conceptual alternatives and retention of others,review by the Study Team led to the elimination of some conceptual alternatives and retention of others,review by the Study Team led to the elimination of some conceptual alternatives and retention of others,review by the Study Team led to the elimination of some conceptual alternatives and retention of others,review by the Study Team led to the elimination of some conceptual alternatives and retention of others
for detailed study in the DEIS (see sections 2.2 and 2.3).,for detailed study in the DEIS (see sections 2.2 and 2.3).,for detailed study in the DEIS (see sections 2.2 and 2.3).,for detailed study in the DEIS (see sections 2.2 and 2.3).,for detailed study in the DEIS (see sections 2.2 and 2.3).,for detailed study in the DEIS (see sections 2.2 and 2.3).,for detailed study in the DEIS (see sections 2.2 and 2.3).,for detailed study in the DEIS (see sections 2.2 and 2.3).,for detailed study in the DEIS (see sections 2.2 and 2.3).,for detailed study in the DEIS (see sections 2.2 and 2.3).,for detailed study in the DEIS (see sections 2.2 and 2.3).,The agencies involved agreed with eliminating,The agencies involved agreed with eliminating,The agencies involved agreed with eliminating,The agencies involved agreed with eliminating,The agencies involved agreed with eliminating,The agencies involved agreed with eliminating,The agencies involved agreed with eliminating,The agencies involved agreed with eliminating,The agencies involved agreed with eliminating,The agencies involved agreed with eliminating
Alternative E and the segments of Alternative D that were not associated with the DC1 Alternative.,Alternative E and the segments of Alternative D that were not associated with the DC1 Alternative.,Alternative E and the segments of Alternative D that were not associated with the DC1 Alternative.,Alternative E and the segments of Alternative D that were not associated with the DC1 Alternative.,Alternative E and the segments of Alternative D that were not associated with the DC1 Alternative.,Alternative E and the segments of Alternative D that were not associated with the DC1 Alternative.,Alternative E and the segments of Alternative D that were not associated with the DC1 Alternative.,Alternative E and the segments of Alternative D that were not associated with the DC1 Alternative.,Alternative E and the segments of Alternative D that were not associated with the DC1 Alternative.,Alternative E and the segments of Alternative D that were not associated with the DC1 Alternative.,Alternative E and the segments of Alternative D that were not associated with the DC1 Alternative.,Alternative E and the segments of Alternative D that were not associated with the DC1 Alternative.,Alternative E and the segments of Alternative D that were not associated with the DC1 Alternative.,Alternative E and the segments of Alternative D that were not associated with the DC1 Alternative.,Alternative E and the segments of Alternative D that were not associated with the DC1 Alternative.,Alternative E and the segments of Alternative D that were not associated with the DC1 Alternative.,Alternative E and the segments of Alternative D that were not associated with the DC1 Alternative.,Alternative E and the segments of Alternative D that were not associated with the DC1 Alternative.,Alternative E and the segments of Alternative D that were not associated with the DC1 Alternative.,After,After
consideration,consideration,of,this,agency,agency,"input,",public,public,"comments,","comments,",and,technical,technical,review,by,the,Study,"Team,","Team,",the
following alternatives were retained for detailed analysis the DEIS.,following alternatives were retained for detailed analysis the DEIS.,following alternatives were retained for detailed analysis the DEIS.,following alternatives were retained for detailed analysis the DEIS.,following alternatives were retained for detailed analysis the DEIS.,following alternatives were retained for detailed analysis the DEIS.,following alternatives were retained for detailed analysis the DEIS.,following alternatives were retained for detailed analysis the DEIS.,following alternatives were retained for detailed analysis the DEIS.,following alternatives were retained for detailed analysis the DEIS.,following alternatives were retained for detailed analysis the DEIS.,following alternatives were retained for detailed analysis the DEIS.,following alternatives were retained for detailed analysis the DEIS.,,,,,,,,
•,"Alternative AC, henceforth, CBA One.","Alternative AC, henceforth, CBA One.","Alternative AC, henceforth, CBA One.","Alternative AC, henceforth, CBA One.","Alternative AC, henceforth, CBA One.","Alternative AC, henceforth, CBA One.","Alternative AC, henceforth, CBA One.","Alternative AC, henceforth, CBA One.","Alternative AC, henceforth, CBA One.",,,,,,,,,,,
•,"Alternative B1, henceforth, CBA Two.","Alternative B1, henceforth, CBA Two.","Alternative B1, henceforth, CBA Two.","Alternative B1, henceforth, CBA Two.","Alternative B1, henceforth, CBA Two.","Alternative B1, henceforth, CBA Two.","Alternative B1, henceforth, CBA Two.","Alternative B1, henceforth, CBA Two.","Alternative B1, henceforth, CBA Two.",,,,,,,,,,,
•,"Alternative DC1, henceforth CBA Three.","Alternative DC1, henceforth CBA Three.","Alternative DC1, henceforth CBA Three.","Alternative DC1, henceforth CBA Three.","Alternative DC1, henceforth CBA Three.","Alternative DC1, henceforth CBA Three.","Alternative DC1, henceforth CBA Three.","Alternative DC1, henceforth CBA Three.","Alternative DC1, henceforth CBA Three.",,,,,,,,,,,
•,TSM Alternative,TSM Alternative,TSM Alternative,,,,,,,,,,,,,,,,,
•,No-Build Alternative,No-Build Alternative,No-Build Alternative,No-Build Alternative,,,,,,,,,,,,,,,,
