Name: “Table 1 of 1 on page 17 of 23”,Name: “Table 1 of 1 on page 17 of 23”,Name: “Table 1 of 1 on page 17 of 23”,Name: “Table 1 of 1 on page 17 of 23”,Name: “Table 1 of 1 on page 17 of 23”,Name: “Table 1 of 1 on page 17 of 23”,Name: “Table 1 of 1 on page 17 of 23”,Name: “Table 1 of 1 on page 17 of 23”,Name: “Table 1 of 1 on page 17 of 23”,Name: “Table 1 of 1 on page 17 of 23”,Name: “Table 1 of 1 on page 17 of 23”,Name: “Table 1 of 1 on page 17 of 23”,Name: “Table 1 of 1 on page 17 of 23”,Name: “Table 1 of 1 on page 17 of 23”,Name: “Table 1 of 1 on page 17 of 23”,Name: “Table 1 of 1 on page 17 of 23”,Name: “Table 1 of 1 on page 17 of 23”,Name: “Table 1 of 1 on page 17 of 23”,Name: “Table 1 of 1 on page 17 of 23”,Name: “Table 1 of 1 on page 17 of 23”,Name: “Table 1 of 1 on page 17 of 23”
Table: 17,Table: 17,Table: 17,Table: 17,Table: 17,Table: 17,Table: 17,Table: 17,Table: 17,Table: 17,Table: 17,Table: 17,Table: 17,Table: 17,Table: 17,Table: 17,Table: 17,Table: 17,Table: 17,Table: 17,Table: 17
,,,,,,,,,,,,,,,,,,,,
2.4,,IDENTIFICATION OF CANDIDATE BUILD ALTERNATIVES,IDENTIFICATION OF CANDIDATE BUILD ALTERNATIVES,IDENTIFICATION OF CANDIDATE BUILD ALTERNATIVES,IDENTIFICATION OF CANDIDATE BUILD ALTERNATIVES,IDENTIFICATION OF CANDIDATE BUILD ALTERNATIVES,IDENTIFICATION OF CANDIDATE BUILD ALTERNATIVES,IDENTIFICATION OF CANDIDATE BUILD ALTERNATIVES,IDENTIFICATION OF CANDIDATE BUILD ALTERNATIVES,IDENTIFICATION OF CANDIDATE BUILD ALTERNATIVES,IDENTIFICATION OF CANDIDATE BUILD ALTERNATIVES,IDENTIFICATION OF CANDIDATE BUILD ALTERNATIVES,IDENTIFICATION OF CANDIDATE BUILD ALTERNATIVES,IDENTIFICATION OF CANDIDATE BUILD ALTERNATIVES,,,,,,
The screening process identified conceptual alternatives and combinations of alternatives that met project,The screening process identified conceptual alternatives and combinations of alternatives that met project,The screening process identified conceptual alternatives and combinations of alternatives that met project,The screening process identified conceptual alternatives and combinations of alternatives that met project,The screening process identified conceptual alternatives and combinations of alternatives that met project,The screening process identified conceptual alternatives and combinations of alternatives that met project,The screening process identified conceptual alternatives and combinations of alternatives that met project,The screening process identified conceptual alternatives and combinations of alternatives that met project,The screening process identified conceptual alternatives and combinations of alternatives that met project,The screening process identified conceptual alternatives and combinations of alternatives that met project,The screening process identified conceptual alternatives and combinations of alternatives that met project,The screening process identified conceptual alternatives and combinations of alternatives that met project,The screening process identified conceptual alternatives and combinations of alternatives that met project,The screening process identified conceptual alternatives and combinations of alternatives that met project,The screening process identified conceptual alternatives and combinations of alternatives that met project,The screening process identified conceptual alternatives and combinations of alternatives that met project,The screening process identified conceptual alternatives and combinations of alternatives that met project,The screening process identified conceptual alternatives and combinations of alternatives that met project,The screening process identified conceptual alternatives and combinations of alternatives that met project,The screening process identified conceptual alternatives and combinations of alternatives that met project,The screening process identified conceptual alternatives and combinations of alternatives that met project
needs while reducing impacts to the human and natural environments. The ten alternatives listed in Table,needs while reducing impacts to the human and natural environments. The ten alternatives listed in Table,needs while reducing impacts to the human and natural environments. The ten alternatives listed in Table,needs while reducing impacts to the human and natural environments. The ten alternatives listed in Table,needs while reducing impacts to the human and natural environments. The ten alternatives listed in Table,needs while reducing impacts to the human and natural environments. The ten alternatives listed in Table,needs while reducing impacts to the human and natural environments. The ten alternatives listed in Table,needs while reducing impacts to the human and natural environments. The ten alternatives listed in Table,needs while reducing impacts to the human and natural environments. The ten alternatives listed in Table,needs while reducing impacts to the human and natural environments. The ten alternatives listed in Table,needs while reducing impacts to the human and natural environments. The ten alternatives listed in Table,needs while reducing impacts to the human and natural environments. The ten alternatives listed in Table,needs while reducing impacts to the human and natural environments. The ten alternatives listed in Table,needs while reducing impacts to the human and natural environments. The ten alternatives listed in Table,needs while reducing impacts to the human and natural environments. The ten alternatives listed in Table,needs while reducing impacts to the human and natural environments. The ten alternatives listed in Table,needs while reducing impacts to the human and natural environments. The ten alternatives listed in Table,needs while reducing impacts to the human and natural environments. The ten alternatives listed in Table,needs while reducing impacts to the human and natural environments. The ten alternatives listed in Table,needs while reducing impacts to the human and natural environments. The ten alternatives listed in Table,needs while reducing impacts to the human and natural environments. The ten alternatives listed in Table
2.3-1 were grouped by the study team according to their location in relation to the existing Route 460. The,2.3-1 were grouped by the study team according to their location in relation to the existing Route 460. The,2.3-1 were grouped by the study team according to their location in relation to the existing Route 460. The,2.3-1 were grouped by the study team according to their location in relation to the existing Route 460. The,2.3-1 were grouped by the study team according to their location in relation to the existing Route 460. The,2.3-1 were grouped by the study team according to their location in relation to the existing Route 460. The,2.3-1 were grouped by the study team according to their location in relation to the existing Route 460. The,2.3-1 were grouped by the study team according to their location in relation to the existing Route 460. The,2.3-1 were grouped by the study team according to their location in relation to the existing Route 460. The,2.3-1 were grouped by the study team according to their location in relation to the existing Route 460. The,2.3-1 were grouped by the study team according to their location in relation to the existing Route 460. The,2.3-1 were grouped by the study team according to their location in relation to the existing Route 460. The,2.3-1 were grouped by the study team according to their location in relation to the existing Route 460. The,2.3-1 were grouped by the study team according to their location in relation to the existing Route 460. The,2.3-1 were grouped by the study team according to their location in relation to the existing Route 460. The,2.3-1 were grouped by the study team according to their location in relation to the existing Route 460. The,2.3-1 were grouped by the study team according to their location in relation to the existing Route 460. The,2.3-1 were grouped by the study team according to their location in relation to the existing Route 460. The,2.3-1 were grouped by the study team according to their location in relation to the existing Route 460. The,2.3-1 were grouped by the study team according to their location in relation to the existing Route 460. The,2.3-1 were grouped by the study team according to their location in relation to the existing Route 460. The
"Improve Existing, B, and B1 Alternatives use some or all of the existing Route 460 alignment. Alternatives","Improve Existing, B, and B1 Alternatives use some or all of the existing Route 460 alignment. Alternatives","Improve Existing, B, and B1 Alternatives use some or all of the existing Route 460 alignment. Alternatives","Improve Existing, B, and B1 Alternatives use some or all of the existing Route 460 alignment. Alternatives","Improve Existing, B, and B1 Alternatives use some or all of the existing Route 460 alignment. Alternatives","Improve Existing, B, and B1 Alternatives use some or all of the existing Route 460 alignment. Alternatives","Improve Existing, B, and B1 Alternatives use some or all of the existing Route 460 alignment. Alternatives","Improve Existing, B, and B1 Alternatives use some or all of the existing Route 460 alignment. Alternatives","Improve Existing, B, and B1 Alternatives use some or all of the existing Route 460 alignment. Alternatives","Improve Existing, B, and B1 Alternatives use some or all of the existing Route 460 alignment. Alternatives","Improve Existing, B, and B1 Alternatives use some or all of the existing Route 460 alignment. Alternatives","Improve Existing, B, and B1 Alternatives use some or all of the existing Route 460 alignment. Alternatives","Improve Existing, B, and B1 Alternatives use some or all of the existing Route 460 alignment. Alternatives","Improve Existing, B, and B1 Alternatives use some or all of the existing Route 460 alignment. Alternatives","Improve Existing, B, and B1 Alternatives use some or all of the existing Route 460 alignment. Alternatives","Improve Existing, B, and B1 Alternatives use some or all of the existing Route 460 alignment. Alternatives","Improve Existing, B, and B1 Alternatives use some or all of the existing Route 460 alignment. Alternatives","Improve Existing, B, and B1 Alternatives use some or all of the existing Route 460 alignment. Alternatives","Improve Existing, B, and B1 Alternatives use some or all of the existing Route 460 alignment. Alternatives","Improve Existing, B, and B1 Alternatives use some or all of the existing Route 460 alignment. Alternatives","Improve Existing, B, and B1 Alternatives use some or all of the existing Route 460 alignment. Alternatives"
"A and AC are both located south of the existing Route 460. The remaining alternatives (C, D, DC, DC1","A and AC are both located south of the existing Route 460. The remaining alternatives (C, D, DC, DC1","A and AC are both located south of the existing Route 460. The remaining alternatives (C, D, DC, DC1","A and AC are both located south of the existing Route 460. The remaining alternatives (C, D, DC, DC1","A and AC are both located south of the existing Route 460. The remaining alternatives (C, D, DC, DC1","A and AC are both located south of the existing Route 460. The remaining alternatives (C, D, DC, DC1","A and AC are both located south of the existing Route 460. The remaining alternatives (C, D, DC, DC1","A and AC are both located south of the existing Route 460. The remaining alternatives (C, D, DC, DC1","A and AC are both located south of the existing Route 460. The remaining alternatives (C, D, DC, DC1","A and AC are both located south of the existing Route 460. The remaining alternatives (C, D, DC, DC1","A and AC are both located south of the existing Route 460. The remaining alternatives (C, D, DC, DC1","A and AC are both located south of the existing Route 460. The remaining alternatives (C, D, DC, DC1","A and AC are both located south of the existing Route 460. The remaining alternatives (C, D, DC, DC1","A and AC are both located south of the existing Route 460. The remaining alternatives (C, D, DC, DC1","A and AC are both located south of the existing Route 460. The remaining alternatives (C, D, DC, DC1","A and AC are both located south of the existing Route 460. The remaining alternatives (C, D, DC, DC1","A and AC are both located south of the existing Route 460. The remaining alternatives (C, D, DC, DC1","A and AC are both located south of the existing Route 460. The remaining alternatives (C, D, DC, DC1","A and AC are both located south of the existing Route 460. The remaining alternatives (C, D, DC, DC1","A and AC are both located south of the existing Route 460. The remaining alternatives (C, D, DC, DC1","A and AC are both located south of the existing Route 460. The remaining alternatives (C, D, DC, DC1"
and E) are each located north of the existing Route 460.,and E) are each located north of the existing Route 460.,and E) are each located north of the existing Route 460.,and E) are each located north of the existing Route 460.,and E) are each located north of the existing Route 460.,and E) are each located north of the existing Route 460.,and E) are each located north of the existing Route 460.,and E) are each located north of the existing Route 460.,and E) are each located north of the existing Route 460.,and E) are each located north of the existing Route 460.,and E) are each located north of the existing Route 460.,,,,,,,,,,
The,Improve,Existing,Existing,460,,Alternative,Alternative,has,the,highest,number,number,of,estimated,estimated,displacements,displacements,displacements,of,the
"conceptual alternatives. Alternative B has the second highest number of displacements, and also has the","conceptual alternatives. Alternative B has the second highest number of displacements, and also has the","conceptual alternatives. Alternative B has the second highest number of displacements, and also has the","conceptual alternatives. Alternative B has the second highest number of displacements, and also has the","conceptual alternatives. Alternative B has the second highest number of displacements, and also has the","conceptual alternatives. Alternative B has the second highest number of displacements, and also has the","conceptual alternatives. Alternative B has the second highest number of displacements, and also has the","conceptual alternatives. Alternative B has the second highest number of displacements, and also has the","conceptual alternatives. Alternative B has the second highest number of displacements, and also has the","conceptual alternatives. Alternative B has the second highest number of displacements, and also has the","conceptual alternatives. Alternative B has the second highest number of displacements, and also has the","conceptual alternatives. Alternative B has the second highest number of displacements, and also has the","conceptual alternatives. Alternative B has the second highest number of displacements, and also has the","conceptual alternatives. Alternative B has the second highest number of displacements, and also has the","conceptual alternatives. Alternative B has the second highest number of displacements, and also has the","conceptual alternatives. Alternative B has the second highest number of displacements, and also has the","conceptual alternatives. Alternative B has the second highest number of displacements, and also has the","conceptual alternatives. Alternative B has the second highest number of displacements, and also has the","conceptual alternatives. Alternative B has the second highest number of displacements, and also has the","conceptual alternatives. Alternative B has the second highest number of displacements, and also has the","conceptual alternatives. Alternative B has the second highest number of displacements, and also has the"
highest,cost,estimate.,estimate.,The,,B1,hybrid,was,created,to,reduce,reduce,the,number,of,potential,displacements,displacements,displacements,displacements
compared to Alternative B.,compared to Alternative B.,compared to Alternative B.,compared to Alternative B.,compared to Alternative B.,,,,,,,,,,,,,,,,
The,two,alignments,alignments,on,the,south,side,of,existing,Route,Route,460,(Alternatives,(Alternatives,A,and,AC),have,similar,similar
"evaluation results. Alternative AC was created to reduce the number of displacements of Alternative A,","evaluation results. Alternative AC was created to reduce the number of displacements of Alternative A,","evaluation results. Alternative AC was created to reduce the number of displacements of Alternative A,","evaluation results. Alternative AC was created to reduce the number of displacements of Alternative A,","evaluation results. Alternative AC was created to reduce the number of displacements of Alternative A,","evaluation results. Alternative AC was created to reduce the number of displacements of Alternative A,","evaluation results. Alternative AC was created to reduce the number of displacements of Alternative A,","evaluation results. Alternative AC was created to reduce the number of displacements of Alternative A,","evaluation results. Alternative AC was created to reduce the number of displacements of Alternative A,","evaluation results. Alternative AC was created to reduce the number of displacements of Alternative A,","evaluation results. Alternative AC was created to reduce the number of displacements of Alternative A,","evaluation results. Alternative AC was created to reduce the number of displacements of Alternative A,","evaluation results. Alternative AC was created to reduce the number of displacements of Alternative A,","evaluation results. Alternative AC was created to reduce the number of displacements of Alternative A,","evaluation results. Alternative AC was created to reduce the number of displacements of Alternative A,","evaluation results. Alternative AC was created to reduce the number of displacements of Alternative A,","evaluation results. Alternative AC was created to reduce the number of displacements of Alternative A,","evaluation results. Alternative AC was created to reduce the number of displacements of Alternative A,","evaluation results. Alternative AC was created to reduce the number of displacements of Alternative A,","evaluation results. Alternative AC was created to reduce the number of displacements of Alternative A,","evaluation results. Alternative AC was created to reduce the number of displacements of Alternative A,"
and to develop an alignment closer to existing Route 460 near the western end of the study area.,and to develop an alignment closer to existing Route 460 near the western end of the study area.,and to develop an alignment closer to existing Route 460 near the western end of the study area.,and to develop an alignment closer to existing Route 460 near the western end of the study area.,and to develop an alignment closer to existing Route 460 near the western end of the study area.,and to develop an alignment closer to existing Route 460 near the western end of the study area.,and to develop an alignment closer to existing Route 460 near the western end of the study area.,and to develop an alignment closer to existing Route 460 near the western end of the study area.,and to develop an alignment closer to existing Route 460 near the western end of the study area.,and to develop an alignment closer to existing Route 460 near the western end of the study area.,and to develop an alignment closer to existing Route 460 near the western end of the study area.,and to develop an alignment closer to existing Route 460 near the western end of the study area.,and to develop an alignment closer to existing Route 460 near the western end of the study area.,and to develop an alignment closer to existing Route 460 near the western end of the study area.,and to develop an alignment closer to existing Route 460 near the western end of the study area.,and to develop an alignment closer to existing Route 460 near the western end of the study area.,and to develop an alignment closer to existing Route 460 near the western end of the study area.,and to develop an alignment closer to existing Route 460 near the western end of the study area.,and to develop an alignment closer to existing Route 460 near the western end of the study area.,,
Alternative E is located the farthest away from the existing communities,Alternative E is located the farthest away from the existing communities,Alternative E is located the farthest away from the existing communities,Alternative E is located the farthest away from the existing communities,Alternative E is located the farthest away from the existing communities,Alternative E is located the farthest away from the existing communities,Alternative E is located the farthest away from the existing communities,Alternative E is located the farthest away from the existing communities,Alternative E is located the farthest away from the existing communities,Alternative E is located the farthest away from the existing communities,Alternative E is located the farthest away from the existing communities,Alternative E is located the farthest away from the existing communities,Alternative E is located the farthest away from the existing communities,Alternative E is located the farthest away from the existing communities,along Route 460. It has the,along Route 460. It has the,along Route 460. It has the,along Route 460. It has the,along Route 460. It has the,along Route 460. It has the,along Route 460. It has the
"lowest forecast travel demand, and also a large number of displacements. Alternative D affects the most","lowest forecast travel demand, and also a large number of displacements. Alternative D affects the most","lowest forecast travel demand, and also a large number of displacements. Alternative D affects the most","lowest forecast travel demand, and also a large number of displacements. Alternative D affects the most","lowest forecast travel demand, and also a large number of displacements. Alternative D affects the most","lowest forecast travel demand, and also a large number of displacements. Alternative D affects the most","lowest forecast travel demand, and also a large number of displacements. Alternative D affects the most","lowest forecast travel demand, and also a large number of displacements. Alternative D affects the most","lowest forecast travel demand, and also a large number of displacements. Alternative D affects the most","lowest forecast travel demand, and also a large number of displacements. Alternative D affects the most","lowest forecast travel demand, and also a large number of displacements. Alternative D affects the most","lowest forecast travel demand, and also a large number of displacements. Alternative D affects the most","lowest forecast travel demand, and also a large number of displacements. Alternative D affects the most","lowest forecast travel demand, and also a large number of displacements. Alternative D affects the most","lowest forecast travel demand, and also a large number of displacements. Alternative D affects the most","lowest forecast travel demand, and also a large number of displacements. Alternative D affects the most","lowest forecast travel demand, and also a large number of displacements. Alternative D affects the most","lowest forecast travel demand, and also a large number of displacements. Alternative D affects the most","lowest forecast travel demand, and also a large number of displacements. Alternative D affects the most","lowest forecast travel demand, and also a large number of displacements. Alternative D affects the most","lowest forecast travel demand, and also a large number of displacements. Alternative D affects the most"
