travel times.,travel times.,"According to the travel time analysis, the travel time savings of the CBAs would not draw the","According to the travel time analysis, the travel time savings of the CBAs would not draw the","According to the travel time analysis, the travel time savings of the CBAs would not draw the","According to the travel time analysis, the travel time savings of the CBAs would not draw the","According to the travel time analysis, the travel time savings of the CBAs would not draw the","According to the travel time analysis, the travel time savings of the CBAs would not draw the","According to the travel time analysis, the travel time savings of the CBAs would not draw the","According to the travel time analysis, the travel time savings of the CBAs would not draw the","According to the travel time analysis, the travel time savings of the CBAs would not draw the","According to the travel time analysis, the travel time savings of the CBAs would not draw the","According to the travel time analysis, the travel time savings of the CBAs would not draw the","According to the travel time analysis, the travel time savings of the CBAs would not draw the","According to the travel time analysis, the travel time savings of the CBAs would not draw the","According to the travel time analysis, the travel time savings of the CBAs would not draw the","According to the travel time analysis, the travel time savings of the CBAs would not draw the","According to the travel time analysis, the travel time savings of the CBAs would not draw the","According to the travel time analysis, the travel time savings of the CBAs would not draw the","According to the travel time analysis, the travel time savings of the CBAs would not draw the","According to the travel time analysis, the travel time savings of the CBAs would not draw the","According to the travel time analysis, the travel time savings of the CBAs would not draw the","According to the travel time analysis, the travel time savings of the CBAs would not draw the"
"interior counties’ interchanges into the commuter sheds, therefore, the development pressures for sprawl","interior counties’ interchanges into the commuter sheds, therefore, the development pressures for sprawl","interior counties’ interchanges into the commuter sheds, therefore, the development pressures for sprawl","interior counties’ interchanges into the commuter sheds, therefore, the development pressures for sprawl","interior counties’ interchanges into the commuter sheds, therefore, the development pressures for sprawl","interior counties’ interchanges into the commuter sheds, therefore, the development pressures for sprawl","interior counties’ interchanges into the commuter sheds, therefore, the development pressures for sprawl","interior counties’ interchanges into the commuter sheds, therefore, the development pressures for sprawl","interior counties’ interchanges into the commuter sheds, therefore, the development pressures for sprawl","interior counties’ interchanges into the commuter sheds, therefore, the development pressures for sprawl","interior counties’ interchanges into the commuter sheds, therefore, the development pressures for sprawl","interior counties’ interchanges into the commuter sheds, therefore, the development pressures for sprawl","interior counties’ interchanges into the commuter sheds, therefore, the development pressures for sprawl","interior counties’ interchanges into the commuter sheds, therefore, the development pressures for sprawl","interior counties’ interchanges into the commuter sheds, therefore, the development pressures for sprawl","interior counties’ interchanges into the commuter sheds, therefore, the development pressures for sprawl","interior counties’ interchanges into the commuter sheds, therefore, the development pressures for sprawl","interior counties’ interchanges into the commuter sheds, therefore, the development pressures for sprawl","interior counties’ interchanges into the commuter sheds, therefore, the development pressures for sprawl","interior counties’ interchanges into the commuter sheds, therefore, the development pressures for sprawl","interior counties’ interchanges into the commuter sheds, therefore, the development pressures for sprawl","interior counties’ interchanges into the commuter sheds, therefore, the development pressures for sprawl","interior counties’ interchanges into the commuter sheds, therefore, the development pressures for sprawl"
development in the study area are not expected to be great.,development in the study area are not expected to be great.,development in the study area are not expected to be great.,development in the study area are not expected to be great.,development in the study area are not expected to be great.,development in the study area are not expected to be great.,development in the study area are not expected to be great.,development in the study area are not expected to be great.,development in the study area are not expected to be great.,development in the study area are not expected to be great.,development in the study area are not expected to be great.,development in the study area are not expected to be great.,development in the study area are not expected to be great.,development in the study area are not expected to be great.,,,,,,,,,
"However,","However,",suburban,suburban,and,exurban,exurban,exurban,development,development,development,patterns,patterns,elsewhere,elsewhere,in,the,"state,",such,as,Stafford,and,and
"Fauquier Counties in northern Virginia, suggest that some residential development will eventually reach","Fauquier Counties in northern Virginia, suggest that some residential development will eventually reach","Fauquier Counties in northern Virginia, suggest that some residential development will eventually reach","Fauquier Counties in northern Virginia, suggest that some residential development will eventually reach","Fauquier Counties in northern Virginia, suggest that some residential development will eventually reach","Fauquier Counties in northern Virginia, suggest that some residential development will eventually reach","Fauquier Counties in northern Virginia, suggest that some residential development will eventually reach","Fauquier Counties in northern Virginia, suggest that some residential development will eventually reach","Fauquier Counties in northern Virginia, suggest that some residential development will eventually reach","Fauquier Counties in northern Virginia, suggest that some residential development will eventually reach","Fauquier Counties in northern Virginia, suggest that some residential development will eventually reach","Fauquier Counties in northern Virginia, suggest that some residential development will eventually reach","Fauquier Counties in northern Virginia, suggest that some residential development will eventually reach","Fauquier Counties in northern Virginia, suggest that some residential development will eventually reach","Fauquier Counties in northern Virginia, suggest that some residential development will eventually reach","Fauquier Counties in northern Virginia, suggest that some residential development will eventually reach","Fauquier Counties in northern Virginia, suggest that some residential development will eventually reach","Fauquier Counties in northern Virginia, suggest that some residential development will eventually reach","Fauquier Counties in northern Virginia, suggest that some residential development will eventually reach","Fauquier Counties in northern Virginia, suggest that some residential development will eventually reach","Fauquier Counties in northern Virginia, suggest that some residential development will eventually reach","Fauquier Counties in northern Virginia, suggest that some residential development will eventually reach","Fauquier Counties in northern Virginia, suggest that some residential development will eventually reach"
"beyond the existing commuter-sheds, and the travel time savings of the CBAs will make this somewhat","beyond the existing commuter-sheds, and the travel time savings of the CBAs will make this somewhat","beyond the existing commuter-sheds, and the travel time savings of the CBAs will make this somewhat","beyond the existing commuter-sheds, and the travel time savings of the CBAs will make this somewhat","beyond the existing commuter-sheds, and the travel time savings of the CBAs will make this somewhat","beyond the existing commuter-sheds, and the travel time savings of the CBAs will make this somewhat","beyond the existing commuter-sheds, and the travel time savings of the CBAs will make this somewhat","beyond the existing commuter-sheds, and the travel time savings of the CBAs will make this somewhat","beyond the existing commuter-sheds, and the travel time savings of the CBAs will make this somewhat","beyond the existing commuter-sheds, and the travel time savings of the CBAs will make this somewhat","beyond the existing commuter-sheds, and the travel time savings of the CBAs will make this somewhat","beyond the existing commuter-sheds, and the travel time savings of the CBAs will make this somewhat","beyond the existing commuter-sheds, and the travel time savings of the CBAs will make this somewhat","beyond the existing commuter-sheds, and the travel time savings of the CBAs will make this somewhat","beyond the existing commuter-sheds, and the travel time savings of the CBAs will make this somewhat","beyond the existing commuter-sheds, and the travel time savings of the CBAs will make this somewhat","beyond the existing commuter-sheds, and the travel time savings of the CBAs will make this somewhat","beyond the existing commuter-sheds, and the travel time savings of the CBAs will make this somewhat","beyond the existing commuter-sheds, and the travel time savings of the CBAs will make this somewhat","beyond the existing commuter-sheds, and the travel time savings of the CBAs will make this somewhat","beyond the existing commuter-sheds, and the travel time savings of the CBAs will make this somewhat","beyond the existing commuter-sheds, and the travel time savings of the CBAs will make this somewhat","beyond the existing commuter-sheds, and the travel time savings of the CBAs will make this somewhat"
more likely to occur.,more likely to occur.,more likely to occur.,more likely to occur.,"Development and its impacts will, however, also depend on local actions including","Development and its impacts will, however, also depend on local actions including","Development and its impacts will, however, also depend on local actions including","Development and its impacts will, however, also depend on local actions including","Development and its impacts will, however, also depend on local actions including","Development and its impacts will, however, also depend on local actions including","Development and its impacts will, however, also depend on local actions including","Development and its impacts will, however, also depend on local actions including","Development and its impacts will, however, also depend on local actions including","Development and its impacts will, however, also depend on local actions including","Development and its impacts will, however, also depend on local actions including","Development and its impacts will, however, also depend on local actions including","Development and its impacts will, however, also depend on local actions including","Development and its impacts will, however, also depend on local actions including","Development and its impacts will, however, also depend on local actions including","Development and its impacts will, however, also depend on local actions including","Development and its impacts will, however, also depend on local actions including","Development and its impacts will, however, also depend on local actions including","Development and its impacts will, however, also depend on local actions including"
planning,regulations,regulations,regulations,and,the,,provision,provision,of,infrastructure.,infrastructure.,infrastructure.,infrastructure.,Sprawl,development,development,development,development,impacts,cannot,cannot,be
"measured, but based on local coordination and existing comprehensive plans, the lack of impetus from","measured, but based on local coordination and existing comprehensive plans, the lack of impetus from","measured, but based on local coordination and existing comprehensive plans, the lack of impetus from","measured, but based on local coordination and existing comprehensive plans, the lack of impetus from","measured, but based on local coordination and existing comprehensive plans, the lack of impetus from","measured, but based on local coordination and existing comprehensive plans, the lack of impetus from","measured, but based on local coordination and existing comprehensive plans, the lack of impetus from","measured, but based on local coordination and existing comprehensive plans, the lack of impetus from","measured, but based on local coordination and existing comprehensive plans, the lack of impetus from","measured, but based on local coordination and existing comprehensive plans, the lack of impetus from","measured, but based on local coordination and existing comprehensive plans, the lack of impetus from","measured, but based on local coordination and existing comprehensive plans, the lack of impetus from","measured, but based on local coordination and existing comprehensive plans, the lack of impetus from","measured, but based on local coordination and existing comprehensive plans, the lack of impetus from","measured, but based on local coordination and existing comprehensive plans, the lack of impetus from","measured, but based on local coordination and existing comprehensive plans, the lack of impetus from","measured, but based on local coordination and existing comprehensive plans, the lack of impetus from","measured, but based on local coordination and existing comprehensive plans, the lack of impetus from","measured, but based on local coordination and existing comprehensive plans, the lack of impetus from","measured, but based on local coordination and existing comprehensive plans, the lack of impetus from","measured, but based on local coordination and existing comprehensive plans, the lack of impetus from","measured, but based on local coordination and existing comprehensive plans, the lack of impetus from","measured, but based on local coordination and existing comprehensive plans, the lack of impetus from"
"travel time savings, and the modest population growth rates expected in the interior of the study area","travel time savings, and the modest population growth rates expected in the interior of the study area","travel time savings, and the modest population growth rates expected in the interior of the study area","travel time savings, and the modest population growth rates expected in the interior of the study area","travel time savings, and the modest population growth rates expected in the interior of the study area","travel time savings, and the modest population growth rates expected in the interior of the study area","travel time savings, and the modest population growth rates expected in the interior of the study area","travel time savings, and the modest population growth rates expected in the interior of the study area","travel time savings, and the modest population growth rates expected in the interior of the study area","travel time savings, and the modest population growth rates expected in the interior of the study area","travel time savings, and the modest population growth rates expected in the interior of the study area","travel time savings, and the modest population growth rates expected in the interior of the study area","travel time savings, and the modest population growth rates expected in the interior of the study area","travel time savings, and the modest population growth rates expected in the interior of the study area","travel time savings, and the modest population growth rates expected in the interior of the study area","travel time savings, and the modest population growth rates expected in the interior of the study area","travel time savings, and the modest population growth rates expected in the interior of the study area","travel time savings, and the modest population growth rates expected in the interior of the study area","travel time savings, and the modest population growth rates expected in the interior of the study area","travel time savings, and the modest population growth rates expected in the interior of the study area","travel time savings, and the modest population growth rates expected in the interior of the study area","travel time savings, and the modest population growth rates expected in the interior of the study area","travel time savings, and the modest population growth rates expected in the interior of the study area"
"(less than 0.5 percent annually), sprawl development effects are anticipated to be minor in extent.","(less than 0.5 percent annually), sprawl development effects are anticipated to be minor in extent.","(less than 0.5 percent annually), sprawl development effects are anticipated to be minor in extent.","(less than 0.5 percent annually), sprawl development effects are anticipated to be minor in extent.","(less than 0.5 percent annually), sprawl development effects are anticipated to be minor in extent.","(less than 0.5 percent annually), sprawl development effects are anticipated to be minor in extent.","(less than 0.5 percent annually), sprawl development effects are anticipated to be minor in extent.","(less than 0.5 percent annually), sprawl development effects are anticipated to be minor in extent.","(less than 0.5 percent annually), sprawl development effects are anticipated to be minor in extent.","(less than 0.5 percent annually), sprawl development effects are anticipated to be minor in extent.","(less than 0.5 percent annually), sprawl development effects are anticipated to be minor in extent.","(less than 0.5 percent annually), sprawl development effects are anticipated to be minor in extent.","(less than 0.5 percent annually), sprawl development effects are anticipated to be minor in extent.","(less than 0.5 percent annually), sprawl development effects are anticipated to be minor in extent.","(less than 0.5 percent annually), sprawl development effects are anticipated to be minor in extent.","(less than 0.5 percent annually), sprawl development effects are anticipated to be minor in extent.","(less than 0.5 percent annually), sprawl development effects are anticipated to be minor in extent.","(less than 0.5 percent annually), sprawl development effects are anticipated to be minor in extent.","(less than 0.5 percent annually), sprawl development effects are anticipated to be minor in extent.","(less than 0.5 percent annually), sprawl development effects are anticipated to be minor in extent.","(less than 0.5 percent annually), sprawl development effects are anticipated to be minor in extent.",,
4.18.1.3,,Summary of Indirect Land Use Changes,Summary of Indirect Land Use Changes,Summary of Indirect Land Use Changes,Summary of Indirect Land Use Changes,Summary of Indirect Land Use Changes,Summary of Indirect Land Use Changes,Summary of Indirect Land Use Changes,Summary of Indirect Land Use Changes,Summary of Indirect Land Use Changes,Summary of Indirect Land Use Changes,Summary of Indirect Land Use Changes,,,,,,,,,,
Adequate,Adequate,developable,developable,developable,land,is,located,located,within,within,each,one-mile,one-mile,interchange,interchange,,area,to,absorb,the,acres,of
anticipated potential development.,anticipated potential development.,anticipated potential development.,anticipated potential development.,anticipated potential development.,anticipated potential development.,anticipated potential development.,anticipated potential development.,CBAs 1 and 3 would result in the greatest amount of indirect land use,CBAs 1 and 3 would result in the greatest amount of indirect land use,CBAs 1 and 3 would result in the greatest amount of indirect land use,CBAs 1 and 3 would result in the greatest amount of indirect land use,CBAs 1 and 3 would result in the greatest amount of indirect land use,CBAs 1 and 3 would result in the greatest amount of indirect land use,CBAs 1 and 3 would result in the greatest amount of indirect land use,CBAs 1 and 3 would result in the greatest amount of indirect land use,CBAs 1 and 3 would result in the greatest amount of indirect land use,CBAs 1 and 3 would result in the greatest amount of indirect land use,CBAs 1 and 3 would result in the greatest amount of indirect land use,CBAs 1 and 3 would result in the greatest amount of indirect land use,CBAs 1 and 3 would result in the greatest amount of indirect land use,CBAs 1 and 3 would result in the greatest amount of indirect land use,CBAs 1 and 3 would result in the greatest amount of indirect land use
"impacts as a result of the conversion of an additional 340 and 380 acres, respectively.","impacts as a result of the conversion of an additional 340 and 380 acres, respectively.","impacts as a result of the conversion of an additional 340 and 380 acres, respectively.","impacts as a result of the conversion of an additional 340 and 380 acres, respectively.","impacts as a result of the conversion of an additional 340 and 380 acres, respectively.","impacts as a result of the conversion of an additional 340 and 380 acres, respectively.","impacts as a result of the conversion of an additional 340 and 380 acres, respectively.","impacts as a result of the conversion of an additional 340 and 380 acres, respectively.","impacts as a result of the conversion of an additional 340 and 380 acres, respectively.","impacts as a result of the conversion of an additional 340 and 380 acres, respectively.","impacts as a result of the conversion of an additional 340 and 380 acres, respectively.","impacts as a result of the conversion of an additional 340 and 380 acres, respectively.","impacts as a result of the conversion of an additional 340 and 380 acres, respectively.","impacts as a result of the conversion of an additional 340 and 380 acres, respectively.","impacts as a result of the conversion of an additional 340 and 380 acres, respectively.","impacts as a result of the conversion of an additional 340 and 380 acres, respectively.","impacts as a result of the conversion of an additional 340 and 380 acres, respectively.","impacts as a result of the conversion of an additional 340 and 380 acres, respectively.","impacts as a result of the conversion of an additional 340 and 380 acres, respectively.",CBA 2 would,CBA 2 would,CBA 2 would,CBA 2 would
result in the conversion of 50 acres of agricultural and forestlands.,result in the conversion of 50 acres of agricultural and forestlands.,result in the conversion of 50 acres of agricultural and forestlands.,result in the conversion of 50 acres of agricultural and forestlands.,result in the conversion of 50 acres of agricultural and forestlands.,result in the conversion of 50 acres of agricultural and forestlands.,result in the conversion of 50 acres of agricultural and forestlands.,result in the conversion of 50 acres of agricultural and forestlands.,result in the conversion of 50 acres of agricultural and forestlands.,result in the conversion of 50 acres of agricultural and forestlands.,result in the conversion of 50 acres of agricultural and forestlands.,result in the conversion of 50 acres of agricultural and forestlands.,result in the conversion of 50 acres of agricultural and forestlands.,result in the conversion of 50 acres of agricultural and forestlands.,result in the conversion of 50 acres of agricultural and forestlands.,The effect of these additional land use,The effect of these additional land use,The effect of these additional land use,The effect of these additional land use,The effect of these additional land use,The effect of these additional land use,The effect of these additional land use,The effect of these additional land use
