Name: “Table 1 of 1 on page 7 of 33”,Name: “Table 1 of 1 on page 7 of 33”,Name: “Table 1 of 1 on page 7 of 33”,Name: “Table 1 of 1 on page 7 of 33”,Name: “Table 1 of 1 on page 7 of 33”,Name: “Table 1 of 1 on page 7 of 33”,Name: “Table 1 of 1 on page 7 of 33”,Name: “Table 1 of 1 on page 7 of 33”,Name: “Table 1 of 1 on page 7 of 33”,Name: “Table 1 of 1 on page 7 of 33”,Name: “Table 1 of 1 on page 7 of 33”,Name: “Table 1 of 1 on page 7 of 33”,Name: “Table 1 of 1 on page 7 of 33”,Name: “Table 1 of 1 on page 7 of 33”,Name: “Table 1 of 1 on page 7 of 33”,Name: “Table 1 of 1 on page 7 of 33”,Name: “Table 1 of 1 on page 7 of 33”,Name: “Table 1 of 1 on page 7 of 33”,Name: “Table 1 of 1 on page 7 of 33”,Name: “Table 1 of 1 on page 7 of 33”,Name: “Table 1 of 1 on page 7 of 33”,Name: “Table 1 of 1 on page 7 of 33”,Name: “Table 1 of 1 on page 7 of 33”
Table: 7,Table: 7,Table: 7,Table: 7,Table: 7,Table: 7,Table: 7,Table: 7,Table: 7,Table: 7,Table: 7,Table: 7,Table: 7,Table: 7,Table: 7,Table: 7,Table: 7,Table: 7,Table: 7,Table: 7,Table: 7,Table: 7,Table: 7
,,,,,,,,,,,,,,,,,,,,,,
4.18.1.2,,Land Use Changes beyond Interchange Areas,Land Use Changes beyond Interchange Areas,Land Use Changes beyond Interchange Areas,Land Use Changes beyond Interchange Areas,Land Use Changes beyond Interchange Areas,Land Use Changes beyond Interchange Areas,Land Use Changes beyond Interchange Areas,Land Use Changes beyond Interchange Areas,Land Use Changes beyond Interchange Areas,Land Use Changes beyond Interchange Areas,Land Use Changes beyond Interchange Areas,Land Use Changes beyond Interchange Areas,,,,,,,,,
An,increasing,increasing,rate,of,conversion,conversion,conversion,of,land,to,residential,residential,uses,may,also,,occur,beyond,the,the,proposed,proposed
interchange locations.,interchange locations.,interchange locations.,interchange locations.,interchange locations.,These land use changes beyond the existing suburban development would likely,These land use changes beyond the existing suburban development would likely,These land use changes beyond the existing suburban development would likely,These land use changes beyond the existing suburban development would likely,These land use changes beyond the existing suburban development would likely,These land use changes beyond the existing suburban development would likely,These land use changes beyond the existing suburban development would likely,These land use changes beyond the existing suburban development would likely,These land use changes beyond the existing suburban development would likely,These land use changes beyond the existing suburban development would likely,These land use changes beyond the existing suburban development would likely,These land use changes beyond the existing suburban development would likely,These land use changes beyond the existing suburban development would likely,These land use changes beyond the existing suburban development would likely,These land use changes beyond the existing suburban development would likely,These land use changes beyond the existing suburban development would likely,These land use changes beyond the existing suburban development would likely,These land use changes beyond the existing suburban development would likely
"be the cumulative result of regional population growth, market trends, and travel time savings.","be the cumulative result of regional population growth, market trends, and travel time savings.","be the cumulative result of regional population growth, market trends, and travel time savings.","be the cumulative result of regional population growth, market trends, and travel time savings.","be the cumulative result of regional population growth, market trends, and travel time savings.","be the cumulative result of regional population growth, market trends, and travel time savings.","be the cumulative result of regional population growth, market trends, and travel time savings.","be the cumulative result of regional population growth, market trends, and travel time savings.","be the cumulative result of regional population growth, market trends, and travel time savings.","be the cumulative result of regional population growth, market trends, and travel time savings.","be the cumulative result of regional population growth, market trends, and travel time savings.","be the cumulative result of regional population growth, market trends, and travel time savings.","be the cumulative result of regional population growth, market trends, and travel time savings.","be the cumulative result of regional population growth, market trends, and travel time savings.","be the cumulative result of regional population growth, market trends, and travel time savings.","be the cumulative result of regional population growth, market trends, and travel time savings.","be the cumulative result of regional population growth, market trends, and travel time savings.","be the cumulative result of regional population growth, market trends, and travel time savings.","be the cumulative result of regional population growth, market trends, and travel time savings.","be the cumulative result of regional population growth, market trends, and travel time savings.",,,
"For this analysis, this potential indirect land use impact is termed “sprawl development” and is defined as","For this analysis, this potential indirect land use impact is termed “sprawl development” and is defined as","For this analysis, this potential indirect land use impact is termed “sprawl development” and is defined as","For this analysis, this potential indirect land use impact is termed “sprawl development” and is defined as","For this analysis, this potential indirect land use impact is termed “sprawl development” and is defined as","For this analysis, this potential indirect land use impact is termed “sprawl development” and is defined as","For this analysis, this potential indirect land use impact is termed “sprawl development” and is defined as","For this analysis, this potential indirect land use impact is termed “sprawl development” and is defined as","For this analysis, this potential indirect land use impact is termed “sprawl development” and is defined as","For this analysis, this potential indirect land use impact is termed “sprawl development” and is defined as","For this analysis, this potential indirect land use impact is termed “sprawl development” and is defined as","For this analysis, this potential indirect land use impact is termed “sprawl development” and is defined as","For this analysis, this potential indirect land use impact is termed “sprawl development” and is defined as","For this analysis, this potential indirect land use impact is termed “sprawl development” and is defined as","For this analysis, this potential indirect land use impact is termed “sprawl development” and is defined as","For this analysis, this potential indirect land use impact is termed “sprawl development” and is defined as","For this analysis, this potential indirect land use impact is termed “sprawl development” and is defined as","For this analysis, this potential indirect land use impact is termed “sprawl development” and is defined as","For this analysis, this potential indirect land use impact is termed “sprawl development” and is defined as","For this analysis, this potential indirect land use impact is termed “sprawl development” and is defined as","For this analysis, this potential indirect land use impact is termed “sprawl development” and is defined as","For this analysis, this potential indirect land use impact is termed “sprawl development” and is defined as","For this analysis, this potential indirect land use impact is termed “sprawl development” and is defined as"
new low-density residential development in existing rural areas.,new low-density residential development in existing rural areas.,new low-density residential development in existing rural areas.,new low-density residential development in existing rural areas.,new low-density residential development in existing rural areas.,new low-density residential development in existing rural areas.,new low-density residential development in existing rural areas.,new low-density residential development in existing rural areas.,new low-density residential development in existing rural areas.,new low-density residential development in existing rural areas.,new low-density residential development in existing rural areas.,new low-density residential development in existing rural areas.,new low-density residential development in existing rural areas.,new low-density residential development in existing rural areas.,Existing commuting patterns reveal that,Existing commuting patterns reveal that,Existing commuting patterns reveal that,Existing commuting patterns reveal that,Existing commuting patterns reveal that,Existing commuting patterns reveal that,Existing commuting patterns reveal that,Existing commuting patterns reveal that,Existing commuting patterns reveal that
"Prince George residents mainly commute to employment centers west of the study area, while Isle of","Prince George residents mainly commute to employment centers west of the study area, while Isle of","Prince George residents mainly commute to employment centers west of the study area, while Isle of","Prince George residents mainly commute to employment centers west of the study area, while Isle of","Prince George residents mainly commute to employment centers west of the study area, while Isle of","Prince George residents mainly commute to employment centers west of the study area, while Isle of","Prince George residents mainly commute to employment centers west of the study area, while Isle of","Prince George residents mainly commute to employment centers west of the study area, while Isle of","Prince George residents mainly commute to employment centers west of the study area, while Isle of","Prince George residents mainly commute to employment centers west of the study area, while Isle of","Prince George residents mainly commute to employment centers west of the study area, while Isle of","Prince George residents mainly commute to employment centers west of the study area, while Isle of","Prince George residents mainly commute to employment centers west of the study area, while Isle of","Prince George residents mainly commute to employment centers west of the study area, while Isle of","Prince George residents mainly commute to employment centers west of the study area, while Isle of","Prince George residents mainly commute to employment centers west of the study area, while Isle of","Prince George residents mainly commute to employment centers west of the study area, while Isle of","Prince George residents mainly commute to employment centers west of the study area, while Isle of","Prince George residents mainly commute to employment centers west of the study area, while Isle of","Prince George residents mainly commute to employment centers west of the study area, while Isle of","Prince George residents mainly commute to employment centers west of the study area, while Isle of","Prince George residents mainly commute to employment centers west of the study area, while Isle of","Prince George residents mainly commute to employment centers west of the study area, while Isle of"
"Wight, Suffolk, and Surry residents are commuting to major employment centers east or northeast of the","Wight, Suffolk, and Surry residents are commuting to major employment centers east or northeast of the","Wight, Suffolk, and Surry residents are commuting to major employment centers east or northeast of the","Wight, Suffolk, and Surry residents are commuting to major employment centers east or northeast of the","Wight, Suffolk, and Surry residents are commuting to major employment centers east or northeast of the","Wight, Suffolk, and Surry residents are commuting to major employment centers east or northeast of the","Wight, Suffolk, and Surry residents are commuting to major employment centers east or northeast of the","Wight, Suffolk, and Surry residents are commuting to major employment centers east or northeast of the","Wight, Suffolk, and Surry residents are commuting to major employment centers east or northeast of the","Wight, Suffolk, and Surry residents are commuting to major employment centers east or northeast of the","Wight, Suffolk, and Surry residents are commuting to major employment centers east or northeast of the","Wight, Suffolk, and Surry residents are commuting to major employment centers east or northeast of the","Wight, Suffolk, and Surry residents are commuting to major employment centers east or northeast of the","Wight, Suffolk, and Surry residents are commuting to major employment centers east or northeast of the","Wight, Suffolk, and Surry residents are commuting to major employment centers east or northeast of the","Wight, Suffolk, and Surry residents are commuting to major employment centers east or northeast of the","Wight, Suffolk, and Surry residents are commuting to major employment centers east or northeast of the","Wight, Suffolk, and Surry residents are commuting to major employment centers east or northeast of the","Wight, Suffolk, and Surry residents are commuting to major employment centers east or northeast of the","Wight, Suffolk, and Surry residents are commuting to major employment centers east or northeast of the","Wight, Suffolk, and Surry residents are commuting to major employment centers east or northeast of the","Wight, Suffolk, and Surry residents are commuting to major employment centers east or northeast of the","Wight, Suffolk, and Surry residents are commuting to major employment centers east or northeast of the"
study area.,study area.,"In order for areas further to the interior of the Route 460 corridor (i.e., Waverly, Wakefield,","In order for areas further to the interior of the Route 460 corridor (i.e., Waverly, Wakefield,","In order for areas further to the interior of the Route 460 corridor (i.e., Waverly, Wakefield,","In order for areas further to the interior of the Route 460 corridor (i.e., Waverly, Wakefield,","In order for areas further to the interior of the Route 460 corridor (i.e., Waverly, Wakefield,","In order for areas further to the interior of the Route 460 corridor (i.e., Waverly, Wakefield,","In order for areas further to the interior of the Route 460 corridor (i.e., Waverly, Wakefield,","In order for areas further to the interior of the Route 460 corridor (i.e., Waverly, Wakefield,","In order for areas further to the interior of the Route 460 corridor (i.e., Waverly, Wakefield,","In order for areas further to the interior of the Route 460 corridor (i.e., Waverly, Wakefield,","In order for areas further to the interior of the Route 460 corridor (i.e., Waverly, Wakefield,","In order for areas further to the interior of the Route 460 corridor (i.e., Waverly, Wakefield,","In order for areas further to the interior of the Route 460 corridor (i.e., Waverly, Wakefield,","In order for areas further to the interior of the Route 460 corridor (i.e., Waverly, Wakefield,","In order for areas further to the interior of the Route 460 corridor (i.e., Waverly, Wakefield,","In order for areas further to the interior of the Route 460 corridor (i.e., Waverly, Wakefield,","In order for areas further to the interior of the Route 460 corridor (i.e., Waverly, Wakefield,","In order for areas further to the interior of the Route 460 corridor (i.e., Waverly, Wakefield,","In order for areas further to the interior of the Route 460 corridor (i.e., Waverly, Wakefield,","In order for areas further to the interior of the Route 460 corridor (i.e., Waverly, Wakefield,","In order for areas further to the interior of the Route 460 corridor (i.e., Waverly, Wakefield,"
"and Ivor) to become instantly attractive for these same commuter-sheds upon construction of a CBA,","and Ivor) to become instantly attractive for these same commuter-sheds upon construction of a CBA,","and Ivor) to become instantly attractive for these same commuter-sheds upon construction of a CBA,","and Ivor) to become instantly attractive for these same commuter-sheds upon construction of a CBA,","and Ivor) to become instantly attractive for these same commuter-sheds upon construction of a CBA,","and Ivor) to become instantly attractive for these same commuter-sheds upon construction of a CBA,","and Ivor) to become instantly attractive for these same commuter-sheds upon construction of a CBA,","and Ivor) to become instantly attractive for these same commuter-sheds upon construction of a CBA,","and Ivor) to become instantly attractive for these same commuter-sheds upon construction of a CBA,","and Ivor) to become instantly attractive for these same commuter-sheds upon construction of a CBA,","and Ivor) to become instantly attractive for these same commuter-sheds upon construction of a CBA,","and Ivor) to become instantly attractive for these same commuter-sheds upon construction of a CBA,","and Ivor) to become instantly attractive for these same commuter-sheds upon construction of a CBA,","and Ivor) to become instantly attractive for these same commuter-sheds upon construction of a CBA,","and Ivor) to become instantly attractive for these same commuter-sheds upon construction of a CBA,","and Ivor) to become instantly attractive for these same commuter-sheds upon construction of a CBA,","and Ivor) to become instantly attractive for these same commuter-sheds upon construction of a CBA,","and Ivor) to become instantly attractive for these same commuter-sheds upon construction of a CBA,","and Ivor) to become instantly attractive for these same commuter-sheds upon construction of a CBA,","and Ivor) to become instantly attractive for these same commuter-sheds upon construction of a CBA,","and Ivor) to become instantly attractive for these same commuter-sheds upon construction of a CBA,","and Ivor) to become instantly attractive for these same commuter-sheds upon construction of a CBA,","and Ivor) to become instantly attractive for these same commuter-sheds upon construction of a CBA,"
travel,times,would,would,need,to,decrease,decrease,decrease,relative,relative,to,the,2026,No-Build,condition,condition,condition,sufficiently,sufficiently,to,offset,the
increased distance,increased distance,increased distance,increased distance,from,the,employment,employment,employment,centers.,centers.,centers.,If,this,were to,"occur,",,it,would,suggest,a,dramatic,dramatic
change in residential development pressures could occur with the CBA(s).,change in residential development pressures could occur with the CBA(s).,change in residential development pressures could occur with the CBA(s).,change in residential development pressures could occur with the CBA(s).,change in residential development pressures could occur with the CBA(s).,change in residential development pressures could occur with the CBA(s).,change in residential development pressures could occur with the CBA(s).,change in residential development pressures could occur with the CBA(s).,change in residential development pressures could occur with the CBA(s).,change in residential development pressures could occur with the CBA(s).,change in residential development pressures could occur with the CBA(s).,change in residential development pressures could occur with the CBA(s).,change in residential development pressures could occur with the CBA(s).,change in residential development pressures could occur with the CBA(s).,change in residential development pressures could occur with the CBA(s).,change in residential development pressures could occur with the CBA(s).,,,,,,,
"Based on an analysis of commuting patterns, land use plans, and existing and planned development","Based on an analysis of commuting patterns, land use plans, and existing and planned development","Based on an analysis of commuting patterns, land use plans, and existing and planned development","Based on an analysis of commuting patterns, land use plans, and existing and planned development","Based on an analysis of commuting patterns, land use plans, and existing and planned development","Based on an analysis of commuting patterns, land use plans, and existing and planned development","Based on an analysis of commuting patterns, land use plans, and existing and planned development","Based on an analysis of commuting patterns, land use plans, and existing and planned development","Based on an analysis of commuting patterns, land use plans, and existing and planned development","Based on an analysis of commuting patterns, land use plans, and existing and planned development","Based on an analysis of commuting patterns, land use plans, and existing and planned development","Based on an analysis of commuting patterns, land use plans, and existing and planned development","Based on an analysis of commuting patterns, land use plans, and existing and planned development","Based on an analysis of commuting patterns, land use plans, and existing and planned development","Based on an analysis of commuting patterns, land use plans, and existing and planned development","Based on an analysis of commuting patterns, land use plans, and existing and planned development","Based on an analysis of commuting patterns, land use plans, and existing and planned development","Based on an analysis of commuting patterns, land use plans, and existing and planned development","Based on an analysis of commuting patterns, land use plans, and existing and planned development","Based on an analysis of commuting patterns, land use plans, and existing and planned development","Based on an analysis of commuting patterns, land use plans, and existing and planned development","Based on an analysis of commuting patterns, land use plans, and existing and planned development","Based on an analysis of commuting patterns, land use plans, and existing and planned development"
"patterns,",the,eastern,eastern,and western,and western,and western,and western,commuter-sheds,commuter-sheds,commuter-sheds,commuter-sheds,for the,for the,2026,No,Build,Build,Alternative,were,were,identified.,identified.
Travel times with the CBAs from each interchange along the corridor were compared to the No-Build,Travel times with the CBAs from each interchange along the corridor were compared to the No-Build,Travel times with the CBAs from each interchange along the corridor were compared to the No-Build,Travel times with the CBAs from each interchange along the corridor were compared to the No-Build,Travel times with the CBAs from each interchange along the corridor were compared to the No-Build,Travel times with the CBAs from each interchange along the corridor were compared to the No-Build,Travel times with the CBAs from each interchange along the corridor were compared to the No-Build,Travel times with the CBAs from each interchange along the corridor were compared to the No-Build,Travel times with the CBAs from each interchange along the corridor were compared to the No-Build,Travel times with the CBAs from each interchange along the corridor were compared to the No-Build,Travel times with the CBAs from each interchange along the corridor were compared to the No-Build,Travel times with the CBAs from each interchange along the corridor were compared to the No-Build,Travel times with the CBAs from each interchange along the corridor were compared to the No-Build,Travel times with the CBAs from each interchange along the corridor were compared to the No-Build,Travel times with the CBAs from each interchange along the corridor were compared to the No-Build,Travel times with the CBAs from each interchange along the corridor were compared to the No-Build,Travel times with the CBAs from each interchange along the corridor were compared to the No-Build,Travel times with the CBAs from each interchange along the corridor were compared to the No-Build,Travel times with the CBAs from each interchange along the corridor were compared to the No-Build,Travel times with the CBAs from each interchange along the corridor were compared to the No-Build,Travel times with the CBAs from each interchange along the corridor were compared to the No-Build,Travel times with the CBAs from each interchange along the corridor were compared to the No-Build,Travel times with the CBAs from each interchange along the corridor were compared to the No-Build
