Name: “Table 1 of 1 on page 19 of 100”,Name: “Table 1 of 1 on page 19 of 100”
Table: 19,Table: 19
,
,Acknowledgments
This project was funded by the National Park Service Recreation Fee Program’s Storm,This project was funded by the National Park Service Recreation Fee Program’s Storm
Vulnerability Project (PMIS 107946).,"In addition, some of the data collection and methodology"
development used in this report were funded by the Virginia Department of Environmental,development used in this report were funded by the Virginia Department of Environmental
"Quality’s Coastal Resources Management Program through Grants NA17OZ2355,","Quality’s Coastal Resources Management Program through Grants NA17OZ2355,"
"NA17OZ1142, and NA04NOS4190060 of the National Oceanic and Atmospheric","NA17OZ1142, and NA04NOS4190060 of the National Oceanic and Atmospheric"
"Administration (NOAA), Office of Ocean and Coastal Resource Management, under the Coastal","Administration (NOAA), Office of Ocean and Coastal Resource Management, under the Coastal"
"Zone Management Act of 1972, as amended.",
,xvii
